rank,company_name,company_link,country,company_background,company_info,unicorn_joined_date,unicorn_joined_year,sector,city,stage,founded_year,time_to_unicorn,months_to_unicorn,round_led_by,top_investor_1,top_investor_2,top_investors,valuation_usd_bn,total_funding_usd_mn,annual_revenue_cr,employees,latest_round,round_stage,round_year,round_amount_mn,embedding_text
69,Licious,https://tracxn.com/d/companies/licious/__LHekQjRPN_AOxwnNiMe3AcglLl39pCeJSEu6punNiFE,India,"Platform offering meat and seafood delivery. It offers a selection of chicken, mutton, seafood, marinades, and cold cuts. The company maintains a strict cold chain from procurement to delivery, ensuring product freshness. It charges only for the actual weight of meat received by the customer, after removing inedible parts.","Licious joined the Unicorn Club on Oct 05, 2021 after raising a $52M Series G funding round led by , .",2021-10-05,2021,online_grocery,bangalore,Series G,2015,6 years 9 months,81,Avendus,True North,Temasek,"True North, Temasek",1.33,490.0,748.0,,"Series G, Sep 21, 2023, $914K",Series G,2023,,"Licious is an Indian unicorn startup. It operates in the online_grocery sector. It is based in Bangalore. Current stage: Series G. Platform offering meat and seafood delivery. It offers a selection of chicken, mutton, seafood, marinades, and cold cuts. The company maintains a strict cold chain from procurement to delivery, ensuring product freshness. It charges only for the actual weight of meat received by the customer, after removing inedible parts. Licious joined the Unicorn Club on Oct 05, 2021 after raising a $52M Series G funding round led by , . Founded in 2015. Time taken to reach unicorn status: 6 years 9 months. Joined the unicorn club on 2021-10-05. Became a unicorn in 2021. Investors include True North, Temasek, latest round led by Avendus. Valuation: 1.33 billion USD. Total funding raised: 490.0 million USD. Annual revenue: 748.0 crore INR. Latest funding round: Series G. The round took place in 2023."
68,Vedantu,https://tracxn.com/d/companies/vedantu/__jrLUroips5-2o0-xzJxe9tR17nhmFFeccl9XfQ3CuLA,India,"Online education platform offering live classes and offline centers for K1 to K12 students. It offers live tutoring with two-way interaction via whiteboard, audio, and video for school curriculum and competitive exams. The subjects include coding, spoken english programs, mathematics, and more.","Vedantu joined the Unicorn Club on Sep 29, 2021 after raising a $100M Series E funding round led by , , valuing it at $904M.",2021-09-29,2021,k-12_edtech,bangalore,Series E,2011,10 years 8 months,128,ImpactAssets,Test Preparation Tech,WestBridge Capital,"Test Preparation Tech, WestBridge Capital",0.841,326.0,199.0,1088.0,"Series E, Sep 27, 2024, $209K",Series E,2024,,"Vedantu is an Indian unicorn startup. It operates in the k-12_edtech sector. It is based in Bangalore. Current stage: Series E. Online education platform offering live classes and offline centers for K1 to K12 students. It offers live tutoring with two-way interaction via whiteboard, audio, and video for school curriculum and competitive exams. The subjects include coding, spoken english programs, mathematics, and more. Vedantu joined the Unicorn Club on Sep 29, 2021 after raising a $100M Series E funding round led by , , valuing it at $904M. Founded in 2011. Time taken to reach unicorn status: 10 years 8 months. Joined the unicorn club on 2021-09-29. Became a unicorn in 2021. Investors include Test Preparation Tech, WestBridge Capital, latest round led by ImpactAssets. Valuation: 0.841 billion USD. Total funding raised: 326.0 million USD. Annual revenue: 199.0 crore INR. It employs approximately 1088 people. Latest funding round: Series E. The round took place in 2024."
67,Apna,https://tracxn.com/d/companies/apna/__UTcOz_R9Flutxq8RerYdtrlPxtxnXQAjcBTiXLgJon4,India,"Provider of a job platform connecting job seekers and employers. This platform facilitates the matching of candidates with suitable employment opportunities. It offers tools for job searching, resume building, and cover letter creation. The platform also provides resources for career development and job search strategies. Employers utilize the platform to post job openings and access a pool of potential candidates. The service aims to streamline the hiring process for businesses of all sizes.","Apna joined the Unicorn Club on Sep 16, 2021",2021-09-16,2021,hrtech,bangalore,Series C,2019,2 years 8 months,32,,Maverick Ventures,Insight Partners,"Maverick Ventures, Insight Partners",0.194,,10010.0,737.0,"Series C, Sep 15, 2021, $100M",Series C,2021,100.0,"Apna is an Indian unicorn startup. It operates in the hrtech sector. It is based in Bangalore. Current stage: Series C. Provider of a job platform connecting job seekers and employers. This platform facilitates the matching of candidates with suitable employment opportunities. It offers tools for job searching, resume building, and cover letter creation. The platform also provides resources for career development and job search strategies. Employers utilize the platform to post job openings and access a pool of potential candidates. The service aims to streamline the hiring process for businesses of all sizes. Apna joined the Unicorn Club on Sep 16, 2021 Founded in 2019. Time taken to reach unicorn status: 2 years 8 months. Joined the unicorn club on 2021-09-16. Became a unicorn in 2021. Investors include Maverick Ventures, Insight Partners. Valuation: 0.194 billion USD. Annual revenue: 10010.0 crore INR. It employs approximately 737 people. Latest funding round: Series C. The round took place in 2021. Round amount: 100.0 million USD."
66,MPL,https://tracxn.com/d/companies/mpl/__97ejAmkVLyEWMW-X4wicg8mah0j1DrmAPp4uIrG6UUg,India,Online platform offering e-sports and real money casino gaming activities. It provides users with a platform that offers a range of games across different genres allowing players to compete against opponents and leaderboards to win cash prizes.,"MPL joined the Unicorn Club on Sep 15, 2021 after raising a $157M Series E funding round led by , , valuing it at $2.18B.",2021-09-15,2021,sports_tech,bangalore,Series E,2018,3 years 8 months,44,Legatum,eSports,Mobile Gaming,"eSports, Mobile Gaming",2.19,396.0,892.0,397.0,"Series E, Aug 21, 2023, $2.61M",Series E,2023,2.6,"MPL is an Indian unicorn startup. It operates in the sports_tech sector. It is based in Bangalore. Current stage: Series E. Online platform offering e-sports and real money casino gaming activities. It provides users with a platform that offers a range of games across different genres allowing players to compete against opponents and leaderboards to win cash prizes. MPL joined the Unicorn Club on Sep 15, 2021 after raising a $157M Series E funding round led by , , valuing it at $2.18B. Founded in 2018. Time taken to reach unicorn status: 3 years 8 months. Joined the unicorn club on 2021-09-15. Became a unicorn in 2021. Investors include eSports, Mobile Gaming, latest round led by Legatum. Valuation: 2.19 billion USD. Total funding raised: 396.0 million USD. Annual revenue: 892.0 crore INR. It employs approximately 397 people. Latest funding round: Series E. The round took place in 2023. Round amount: 2.6 million USD."
65,Zetwerk,https://tracxn.com/d/companies/zetwerk/__n78BE94Qxh8Psc5IP7-rnqZUlQUUPeCPfBx6SfzpybQ,India,"Provider of manufacturing services and supply chain management. It offers a wide array of manufacturing processes, including die casting, CNC machining, forging, and injection molding, serving diverse industries such as automotive, aerospace, and consumer products. It manages the entire manufacturing process, from design and prototyping to production and delivery, ensuring component delivery. Its network of manufacturing facilities and partners provides scalability and redundancy, mitigating supply chain disruptions. It utilizes proprietary software for project management, enhancing transparency and control throughout the manufacturing process.","Zetwerk joined the Unicorn Club on Aug 20, 2021",2021-08-20,2021,b2b_e-commerce,bangalore,Series F,2018,3 years 7 months,43,,Manufacturing Tech,Baillie Gifford,"Manufacturing Tech, Baillie Gifford",2.791,768.0,14600.0,1049.0,"Series F, Dec 12, 2024, $70M",Series F,2024,70.0,"Zetwerk is an Indian unicorn startup. It operates in the b2b_e-commerce sector. It is based in Bangalore. Current stage: Series F. Provider of manufacturing services and supply chain management. It offers a wide array of manufacturing processes, including die casting, CNC machining, forging, and injection molding, serving diverse industries such as automotive, aerospace, and consumer products. It manages the entire manufacturing process, from design and prototyping to production and delivery, ensuring component delivery. Its network of manufacturing facilities and partners provides scalability and redundancy, mitigating supply chain disruptions. It utilizes proprietary software for project management, enhancing transparency and control throughout the manufacturing process. Zetwerk joined the Unicorn Club on Aug 20, 2021 Founded in 2018. Time taken to reach unicorn status: 3 years 7 months. Joined the unicorn club on 2021-08-20. Became a unicorn in 2021. Investors include Manufacturing Tech, Baillie Gifford. Valuation: 2.791 billion USD. Total funding raised: 768.0 million USD. Annual revenue: 14600.0 crore INR. It employs approximately 1049 people. Latest funding round: Series F. The round took place in 2024. Round amount: 70.0 million USD."
64,Eruditus,https://tracxn.com/d/companies/eruditus/__WyGEGcGZyztDT9IrgRC_d5uZrzFgH7CPL6vRg1G0JyA,Singapore,"Provider of executive-level programs for professionals. It offers programs for comprehensive management. It also provides a senior executive leadership program, an executive program in general management, and more. In addition, it also offers certificates for course completion.","Eruditus joined the Unicorn Club on Aug 12, 2021 after raising a $650M Series E funding round led by , , valuing it at $3.2B.",2021-08-12,2021,continued_learning,singapore,Series F,2010,11 years 7 months,139,Accel,CPP Investments,TPG,"CPP Investments, TPG",3.1,961.0,3685.5,,"Series F, Oct 18, 2024, $150M",Series F,2024,150.0,"Eruditus is an Indian unicorn startup. It operates in the continued_learning sector. It is based in Singapore. Current stage: Series F. Provider of executive-level programs for professionals. It offers programs for comprehensive management. It also provides a senior executive leadership program, an executive program in general management, and more. In addition, it also offers certificates for course completion. Eruditus joined the Unicorn Club on Aug 12, 2021 after raising a $650M Series E funding round led by , , valuing it at $3.2B. Founded in 2010. Time taken to reach unicorn status: 11 years 7 months. Joined the unicorn club on 2021-08-12. Became a unicorn in 2021. Investors include CPP Investments, TPG, latest round led by Accel. Valuation: 3.1 billion USD. Total funding raised: 961.0 million USD. Annual revenue: 3685.5 crore INR. Latest funding round: Series F. The round took place in 2024. Round amount: 150.0 million USD."
63,CoinDCX,https://tracxn.com/d/companies/coindcx/__F--po0QeTrBlGq1SJvFhmGtkg_ebhvwSk6xElIbjTG4,India,"Developer of an app-based exchange platform for cryptocurrency. Its products include crypto deposit and withdrawal solutions, investing and trading solutions for crypto-based financial products for retail, HNI, and enterprise customers. Company exchange offers a variety of products, including fiat onboarding, decentralized lending, margin trading, and futures trading.","CoinDCX joined the Unicorn Club on Aug 10, 2021",2021-08-10,2021,cryptocurrencies,mumbai,Series D,2018,3 years 7 months,43,,Bain Capital Ventures,Jump Capital,"Bain Capital Ventures, Jump Capital",2.15,247.0,394.0,103.0,"Series D, Mar 29, 2022, $135M",Series D,2022,135.0,"CoinDCX is an Indian unicorn startup. It operates in the cryptocurrencies sector. It is based in Mumbai. Current stage: Series D. Developer of an app-based exchange platform for cryptocurrency. Its products include crypto deposit and withdrawal solutions, investing and trading solutions for crypto-based financial products for retail, HNI, and enterprise customers. Company exchange offers a variety of products, including fiat onboarding, decentralized lending, margin trading, and futures trading. CoinDCX joined the Unicorn Club on Aug 10, 2021 Founded in 2018. Time taken to reach unicorn status: 3 years 7 months. Joined the unicorn club on 2021-08-10. Became a unicorn in 2021. Investors include Bain Capital Ventures, Jump Capital. Valuation: 2.15 billion USD. Total funding raised: 247.0 million USD. Annual revenue: 394.0 crore INR. It employs approximately 103 people. Latest funding round: Series D. The round took place in 2022. Round amount: 135.0 million USD."
62,upGrad,https://platform.tracxn.com/a/d/company/-icjnE7vOBF4NySJBQRPK9S5VoPBxTAcTgrkx7epMNE/upgrad.com,India,"Online education platform offering professional courses, certifications, and degree programs for working professionals, focusing on upskilling and reskilling in various fields.","upGrad joined the Unicorn Club on Aug 09, 2021",2021-08-09,2021,continued_learning,mumbai,Series C,2015,6 years 7 months,79,,IFC Asset Management Company,Temasek,"IFC Asset Management Company, Temasek",1.758,329.0,1550.0,8090.0,"Series C, Oct 21, 2024, $60M",Series C,2024,60.0,"upGrad is an Indian unicorn startup. It operates in the continued_learning sector. It is based in Mumbai. Current stage: Series C. Online education platform offering professional courses, certifications, and degree programs for working professionals, focusing on upskilling and reskilling in various fields. upGrad joined the Unicorn Club on Aug 09, 2021 Founded in 2015. Time taken to reach unicorn status: 6 years 7 months. Joined the unicorn club on 2021-08-09. Became a unicorn in 2021. Investors include IFC Asset Management Company, Temasek. Valuation: 1.758 billion USD. Total funding raised: 329.0 million USD. Annual revenue: 1550.0 crore INR. It employs approximately 8090 people. Latest funding round: Series C. The round took place in 2024. Round amount: 60.0 million USD."
61,Mindtickle,https://tracxn.com/d/companies/mindtickle/__rcH04MysyJ9cdvsK3VL8NKlye5BD2niG8tAzh3hIJBE,India,"Cloud based sales enablement software. The platform leverages AI and provides sales training tools to assist sales representatives. It also offers features that include sales forecasting, sales content management, digital sales rooms, sales training, and more. It integrates with Salesforce, Okta, OneLogin, Ping Identity, Symplified, Active Directory, Veeva, Google, and more.","Mindtickle joined the Unicorn Club on Aug 05, 2021 after raising a $100M Series E funding round led by , valuing it at $1.2B.",2021-08-05,2021,sales_force_automation,pune,Series E,2011,10 years 7 months,127,SoftBank Vision Fund,New Enterprise Associates,Norwest Venture Partners,"New Enterprise Associates, Norwest Venture Partners",1.2,281.0,290.0,474.0,"Series E, Aug 05, 2021, $100M",Series E,2021,100.0,"Mindtickle is an Indian unicorn startup. It operates in the sales_force_automation sector. It is based in Pune. Current stage: Series E. Cloud based sales enablement software. The platform leverages AI and provides sales training tools to assist sales representatives. It also offers features that include sales forecasting, sales content management, digital sales rooms, sales training, and more. It integrates with Salesforce, Okta, OneLogin, Ping Identity, Symplified, Active Directory, Veeva, Google, and more. Mindtickle joined the Unicorn Club on Aug 05, 2021 after raising a $100M Series E funding round led by , valuing it at $1.2B. Founded in 2011. Time taken to reach unicorn status: 10 years 7 months. Joined the unicorn club on 2021-08-05. Became a unicorn in 2021. Investors include New Enterprise Associates, Norwest Venture Partners, latest round led by SoftBank Vision Fund. Valuation: 1.2 billion USD. Total funding raised: 281.0 million USD. Annual revenue: 290.0 crore INR. It employs approximately 474 people. Latest funding round: Series E. The round took place in 2021. Round amount: 100.0 million USD."
60,OfBusiness,https://tracxn.com/d/companies/ofbusiness/__aGc6oWtIgdt0twhERclS3Tonc_PwAwpfQ4cNci53GvA,India,"Marketplace for trading multi-category industrial materials. It provides procurement solutions and offers products such as steel, TMT, metals, chemicals, polymers, textiles, cement, and building materials.","OfBusiness joined the Unicorn Club on Jul 31, 2021 after raising a $160M Series E funding round led by , , , valuing it at $3.1B.",2021-07-31,2021,b2b_e-commerce,ahmedabad,Series G,2015,6 years 6 months,78,SoftBank Vision Fund,Construction Tech,Materials Tech,"Construction Tech, Materials Tech",0.776,,23900.0,866.0,"Series G, Apr 16, 2025, $11.7M",Series G,2025,11.7,"OfBusiness is an Indian unicorn startup. It operates in the b2b_e-commerce sector. It is based in Ahmedabad. Current stage: Series G. Marketplace for trading multi-category industrial materials. It provides procurement solutions and offers products such as steel, TMT, metals, chemicals, polymers, textiles, cement, and building materials. OfBusiness joined the Unicorn Club on Jul 31, 2021 after raising a $160M Series E funding round led by , , , valuing it at $3.1B. Founded in 2015. Time taken to reach unicorn status: 6 years 6 months. Joined the unicorn club on 2021-07-31. Became a unicorn in 2021. Investors include Construction Tech, Materials Tech, latest round led by SoftBank Vision Fund. Valuation: 0.776 billion USD. Annual revenue: 23900.0 crore INR. It employs approximately 866 people. Latest funding round: Series G. The round took place in 2025. Round amount: 11.7 million USD."
59,BharatPe,https://tracxn.com/d/companies/bharatpe/__z1vktwhUhiN982R6xgMSEhyBS3Djtq3VGo9zdUy6agg,India,"Provider of QR code-based payment solutions for consumers and businesses. The platform allows users to pay through the bank account by scanning a QR code for various bill payments such as restaurants, cabs, salons, mobile businesses, and more. It also provides lending and investment options. The application is available on both iOS and Android platforms.","BharatPe joined the Unicorn Club on Jul 29, 2021 after raising a $370M Series E funding round led by , valuing it at $2.7B.",2021-07-29,2021,fintech,delhi,Series E,2018,3 years 6 months,42,Tiger Global Management,Dragoneer Investment Group,Insight Partners,"Dragoneer Investment Group, Insight Partners",2.209,604.0,1490.0,605.0,"Conventional Debt, May 07, 2025, $15M",Conventional Debt,2025,15.0,"BharatPe is an Indian unicorn startup. It operates in the fintech sector. It is based in Delhi. Current stage: Series E. Provider of QR code-based payment solutions for consumers and businesses. The platform allows users to pay through the bank account by scanning a QR code for various bill payments such as restaurants, cabs, salons, mobile businesses, and more. It also provides lending and investment options. The application is available on both iOS and Android platforms. BharatPe joined the Unicorn Club on Jul 29, 2021 after raising a $370M Series E funding round led by , valuing it at $2.7B. Founded in 2018. Time taken to reach unicorn status: 3 years 6 months. Joined the unicorn club on 2021-07-29. Became a unicorn in 2021. Investors include Dragoneer Investment Group, Insight Partners, latest round led by Tiger Global Management. Valuation: 2.209 billion USD. Total funding raised: 604.0 million USD. Annual revenue: 1490.0 crore INR. It employs approximately 605 people. Latest funding round: Conventional Debt. The round took place in 2025. Round amount: 15.0 million USD."
58,Droom,https://tracxn.com/d/companies/droom/__r5sS3ynXQ8er90oa-rV4uFHhjph3IJkHzhWR8VuoiGU,India,"AI-powered used vehicle dealer. Users can buy and sell vehicles by providing location, user details, payment details, model details, specification, and more.","Droom joined the Unicorn Club on Jul 28, 2021 after raising a $200M Series G funding round, valuing it at $1.2B.",2021-07-28,2021,auto_e-commerce_&_content,gurgaon,Series G,2014,7 years 6 months,90,,Auto Retail & Aftersales,Digital Garage,"Auto Retail & Aftersales, Digital Garage",0.341,344.0,90.0,139.0,"Series G, Mar 26, 2025, $3M",Series G,2025,3.0,"Droom is an Indian unicorn startup. It operates in the auto_e-commerce_&_content sector. It is based in Gurgaon. Current stage: Series G. AI-powered used vehicle dealer. Users can buy and sell vehicles by providing location, user details, payment details, model details, specification, and more. Droom joined the Unicorn Club on Jul 28, 2021 after raising a $200M Series G funding round, valuing it at $1.2B. Founded in 2014. Time taken to reach unicorn status: 7 years 6 months. Joined the unicorn club on 2021-07-28. Became a unicorn in 2021. Investors include Auto Retail & Aftersales, Digital Garage. Valuation: 0.341 billion USD. Total funding raised: 344.0 million USD. Annual revenue: 90.0 crore INR. It employs approximately 139 people. Latest funding round: Series G. The round took place in 2025. Round amount: 3.0 million USD."
57,BlackBuck,https://tracxn.com/d/companies/blackbuck/__pGeKFczovG7i2k2FPCkvn_wBu6rdS4sZ4lHkQ4HZB1s,India,"A digital trucking platform that connects fleet operators with truckers. It offers services such as load management, GPS tracking, and fuel management solutions. The company offers a range of services, including load-matching, payment at toll booths and fuelling stations, and telematics solutions to track vehicle movement. It connects shippers with fleet operators to locate the trucks, and ship the goods. Features include online payments, transactions history, loading, and unloading details, checking order status, and resolving disputes.","BlackBuck joined the Unicorn Club on Jul 22, 2021",2021-07-22,2021,logistics_tech,bangalore,Public,2015,6 years 6 months,78,,Wellington,Goldman Sachs,"Wellington, Goldman Sachs",0.359,,317.0,1608.0,"Conventional Debt, Jul 18, 2022",Conventional Debt,2022,,"BlackBuck is an Indian unicorn startup. It operates in the logistics_tech sector. It is based in Bangalore. Current stage: Public. A digital trucking platform that connects fleet operators with truckers. It offers services such as load management, GPS tracking, and fuel management solutions. The company offers a range of services, including load-matching, payment at toll booths and fuelling stations, and telematics solutions to track vehicle movement. It connects shippers with fleet operators to locate the trucks, and ship the goods. Features include online payments, transactions history, loading, and unloading details, checking order status, and resolving disputes. BlackBuck joined the Unicorn Club on Jul 22, 2021 Founded in 2015. Time taken to reach unicorn status: 6 years 6 months. Joined the unicorn club on 2021-07-22. Became a unicorn in 2021. Investors include Wellington, Goldman Sachs. Valuation: 0.359 billion USD. Annual revenue: 317.0 crore INR. It employs approximately 1608 people. Latest funding round: Conventional Debt. The round took place in 2022."
56,Blinkit,https://tracxn.com/d/companies/blinkit/__pdyjeRJO4F9T4bszwNqvwPQ3VwyVU6D35oAU-ct-k9M,India,"Online platform offering ultra-fast grocery supply delivery. The product catalog includes fruits, vegetables, bakery supplies, dairy products, snacks, spices, beverages, and more. It also offers personal care, household care, baby care, pet care, stationery, toys, books, and more. The mobile applications is available for both Android and iOS platforms.","Blinkit joined the Unicorn Club on Jun 30, 2021",2021-06-30,2021,online_grocery,gurgaon,Acquired,2013,8 years 5 months,101,,KTB Ventures,SoftBank Group,"KTB Ventures, SoftBank Group",13.0,757.0,1930.0,5054.0,"Conventional Debt, Mar 11, 2022, $150M",Conventional Debt,2022,150.0,"Blinkit is an Indian unicorn startup. It operates in the online_grocery sector. It is based in Gurgaon. Current stage: Acquired. Online platform offering ultra-fast grocery supply delivery. The product catalog includes fruits, vegetables, bakery supplies, dairy products, snacks, spices, beverages, and more. It also offers personal care, household care, baby care, pet care, stationery, toys, books, and more. The mobile applications is available for both Android and iOS platforms. Blinkit joined the Unicorn Club on Jun 30, 2021 Founded in 2013. Time taken to reach unicorn status: 8 years 5 months. Joined the unicorn club on 2021-06-30. Became a unicorn in 2021. Investors include KTB Ventures, SoftBank Group. Valuation: 13.0 billion USD. Total funding raised: 757.0 million USD. Annual revenue: 1930.0 crore INR. It employs approximately 5054 people. Latest funding round: Conventional Debt. The round took place in 2022. Round amount: 150.0 million USD."
