rank,company_name,company_link,country,company_background,company_info,unicorn_joined_date,unicorn_joined_year,sector,city,stage,founded_year,time_to_unicorn,months_to_unicorn,round_led_by,top_investor_1,top_investor_2,top_investors,valuation_usd_bn,total_funding_usd_mn,annual_revenue_cr,employees,latest_round,round_stage,round_year,round_amount_mn,embedding_text
94,Hasura,https://tracxn.com/d/companies/hasura/__SMK3S7BMgtsGtSv97RLd1UJUbyheNG10g9USc7rNJ4A,United States,"Cloud-based graphql API development platform. It enables developers to generate APIs by connecting with databases, and rest APIs. It allows users to develop, optimize, and deploy graphql APIs. The API assists users in data delivery and app development. The platform generates insights into the API performance. Features include authorization, API security, caching, error tracking, and more.","Hasura joined the Unicorn Club on Feb 22, 2022 after raising a $100M Series C funding round led by , valuing it at $1B.",2022-02-22,2022,api_management,san francisco,Series C,2017,5 years 1 month,61,Greenoaks,Lightspeed Venture Partners,Nexus Venture Partners,"Lightspeed Venture Partners, Nexus Venture Partners",1.0,239.0,,,"Series C, Feb 22, 2022, $100M",Series C,2022,100.0,"Hasura is an Indian unicorn startup. It operates in the api_management sector. It is based in San Francisco. Current stage: Series C. Cloud-based graphql API development platform. It enables developers to generate APIs by connecting with databases, and rest APIs. It allows users to develop, optimize, and deploy graphql APIs. The API assists users in data delivery and app development. The platform generates insights into the API performance. Features include authorization, API security, caching, error tracking, and more. Hasura joined the Unicorn Club on Feb 22, 2022 after raising a $100M Series C funding round led by , valuing it at $1B. Founded in 2017. Time taken to reach unicorn status: 5 years 1 month. Joined the unicorn club on 2022-02-22. Became a unicorn in 2022. Investors include Lightspeed Venture Partners, Nexus Venture Partners, latest round led by Greenoaks. Valuation: 1.0 billion USD. Total funding raised: 239.0 million USD. Latest funding round: Series C. The round took place in 2022. Round amount: 100.0 million USD."
93,Uniphore,https://tracxn.com/d/companies/uniphore/__qc0Tx2JG6_zdqzjxpSYBCtGZ5GpjeKyO3PsMME5sWbw,United States,"AI and cloud-based platform offering conversational customer service automation solutions. Its offerings include conversational security and automation software, analytics, conversational assistant, customer engagement, and more. The platform automates agent after call work summaries, and analyze conversations in real time. It is providing insights into customer buying behaviour, and engage with customers.","Uniphore joined the Unicorn Club on Feb 16, 2022",2022-02-16,2022,speech_and_voice_recognition,palo alto,Series E,2008,14 years 1 month,169,,Customer Service Software,Sales Force Automation,"Customer Service Software, Sales Force Automation",1.67,657.0,314.0,363.0,"Series E, Jan 28, 2022, $400M",Series E,2022,400.0,"Uniphore is an Indian unicorn startup. It operates in the speech_and_voice_recognition sector. It is based in Palo Alto. Current stage: Series E. AI and cloud-based platform offering conversational customer service automation solutions. Its offerings include conversational security and automation software, analytics, conversational assistant, customer engagement, and more. The platform automates agent after call work summaries, and analyze conversations in real time. It is providing insights into customer buying behaviour, and engage with customers. Uniphore joined the Unicorn Club on Feb 16, 2022 Founded in 2008. Time taken to reach unicorn status: 14 years 1 month. Joined the unicorn club on 2022-02-16. Became a unicorn in 2022. Investors include Customer Service Software, Sales Force Automation. Valuation: 1.67 billion USD. Total funding raised: 657.0 million USD. Annual revenue: 314.0 crore INR. It employs approximately 363 people. Latest funding round: Series E. The round took place in 2022. Round amount: 400.0 million USD."
92,XpressBees,https://tracxn.com/d/companies/xpressbees/__DKxP1rRdFu6PD1qkXIF_1w595cRKjVa_JTZXdRFdEX4,India,"Provider of logistics and courier solutions. It provides end-to-end domestic supply chain solutions and international logistics services to e-commerce businesses, individuals, and other clients. It provides end to end supply chain solutions and international logistics services to e-commerce businesses. The platform offers technology-enabled solutions, enabling real-time tracking and on-time delivery. It provides logistics services to different clients, from small businesses to large enterprises. The company serves e-commerce businesses and provides tracking solutions for shipment management. It also enables shipment tracking, cargo deliveries, cross-border logistics and transactions, imports and exports, warehousing, and more. It provides integration with online marketplaces, management of stock orders, inventories, returns, and fulfillment.","XpressBees joined the Unicorn Club on Feb 09, 2022 after raising a $100M Series F funding round led by , , , valuing it at $1.11B.",2022-02-09,2022,logistics_tech,pune,Series G,2015,7 years 1 month,85,Blackstone,E-Commerce Enablers,ChrysCapital,"E-Commerce Enablers, ChrysCapital",0.356,,12300.0,31.0,"Series G, Nov 07, 2023, $80M",Series G,2023,80.0,"XpressBees is an Indian unicorn startup. It operates in the logistics_tech sector. It is based in Pune. Current stage: Series G. Provider of logistics and courier solutions. It provides end-to-end domestic supply chain solutions and international logistics services to e-commerce businesses, individuals, and other clients. It provides end to end supply chain solutions and international logistics services to e-commerce businesses. The platform offers technology-enabled solutions, enabling real-time tracking and on-time delivery. It provides logistics services to different clients, from small businesses to large enterprises. The company serves e-commerce businesses and provides tracking solutions for shipment management. It also enables shipment tracking, cargo deliveries, cross-border logistics and transactions, imports and exports, warehousing, and more. It provides integration with online marketplaces, management of stock orders, inventories, returns, and fulfillment. XpressBees joined the Unicorn Club on Feb 09, 2022 after raising a $100M Series F funding round led by , , , valuing it at $1.11B. Founded in 2015. Time taken to reach unicorn status: 7 years 1 month. Joined the unicorn club on 2022-02-09. Became a unicorn in 2022. Investors include E-Commerce Enablers, ChrysCapital, latest round led by Blackstone. Valuation: 0.356 billion USD. Annual revenue: 12300.0 crore INR. It employs approximately 31 people. Latest funding round: Series G. The round took place in 2023. Round amount: 80.0 million USD."
91,ElasticRun,https://tracxn.com/d/companies/elasticrun/__D5twyf2sSsaToMKFo452P6DiWPDTLaatrV2auy25NnQ,India,"Provider of B2B e-commerce and logistics solutions for rural markets. It offers a platform connecting brands directly with rural retailers, facilitating efficient product distribution and sales. It also provides a comprehensive logistics network to support the delivery of goods. The platform's technology stack enables streamlined operations and business management for both brands and retailers. The services offered aim to improve access to goods and services in underserved areas.","ElasticRun joined the Unicorn Club on Feb 08, 2022",2022-02-08,2022,e-commerce_enablers,pune,Series E,2014,8 years 1 month,97,,Rural Ecommerce,In Store Retail Tech,"Rural Ecommerce, In Store Retail Tech",0.8,462.0,2540.0,1253.0,"Series E, Feb 07, 2022, $330M",Series E,2022,330.0,"ElasticRun is an Indian unicorn startup. It operates in the e-commerce_enablers sector. It is based in Pune. Current stage: Series E. Provider of B2B e-commerce and logistics solutions for rural markets. It offers a platform connecting brands directly with rural retailers, facilitating efficient product distribution and sales. It also provides a comprehensive logistics network to support the delivery of goods. The platform's technology stack enables streamlined operations and business management for both brands and retailers. The services offered aim to improve access to goods and services in underserved areas. ElasticRun joined the Unicorn Club on Feb 08, 2022 Founded in 2014. Time taken to reach unicorn status: 8 years 1 month. Joined the unicorn club on 2022-02-08. Became a unicorn in 2022. Investors include Rural Ecommerce, In Store Retail Tech. Valuation: 0.8 billion USD. Total funding raised: 462.0 million USD. Annual revenue: 2540.0 crore INR. It employs approximately 1253 people. Latest funding round: Series E. The round took place in 2022. Round amount: 330.0 million USD."
90,LivSpace,https://tracxn.com/d/companies/livspace/__jW3bucmuxxt7wnW0Ru8fEhLj0iTod5V8Roa0OsWdp9I,India,"Provider of end-to-end home interior design and renovation services. It offers modular solutions for kitchens, wardrobes, and other spaces. Services include design, material sourcing, installation, and project management for both new constructions and renovations. It also provides price calculators for various projects to aid in budgeting. The company offers various design styles and caters to diverse customer preferences. A focus is placed on efficient project completion and customer satisfaction.","LivSpace joined the Unicorn Club on Feb 07, 2022 after raising a $184M Series F funding round led by , ,  and  more, valuing it at $957M.",2022-02-07,2022,home_improvements,bangalore,Series F,2014,8 years 1 month,97,KKR,Property Management Tech,Local Services,"Property Management Tech, Local Services",,527.0,960.0,5210.0,"Series F, Feb 29, 2024",Series F,2024,,"LivSpace is an Indian unicorn startup. It operates in the home_improvements sector. It is based in Bangalore. Current stage: Series F. Provider of end-to-end home interior design and renovation services. It offers modular solutions for kitchens, wardrobes, and other spaces. Services include design, material sourcing, installation, and project management for both new constructions and renovations. It also provides price calculators for various projects to aid in budgeting. The company offers various design styles and caters to diverse customer preferences. A focus is placed on efficient project completion and customer satisfaction. LivSpace joined the Unicorn Club on Feb 07, 2022 after raising a $184M Series F funding round led by , ,  and  more, valuing it at $957M. Founded in 2014. Time taken to reach unicorn status: 8 years 1 month. Joined the unicorn club on 2022-02-07. Became a unicorn in 2022. Investors include Property Management Tech, Local Services, latest round led by KKR. Total funding raised: 527.0 million USD. Annual revenue: 960.0 crore INR. It employs approximately 5210 people. Latest funding round: Series F. The round took place in 2024."
89,DealShare,https://tracxn.com/d/companies/dealshare/__Be_ZMDvJ1M0TqW0p-1XDFDlofY_8IbxqYs1CbvSfEcM,India,"Online social deal-sharing platform for multi-category products. The company offers deals on various products like fruits & vegetables, grocery items, fashion accessories, home decor products, and more. It allows users to buy and share deals with their friends. The company offers discounts depending on the number of people purchasing its products.","DealShare joined the Unicorn Club on Jan 27, 2022 after raising a $210M Series E funding round led by , , valuing it at $1.71B.",2022-01-27,2022,social_commerce,bangalore,Series E,2018,4 years,48,Tiger Global Management,Online Grocery,WestBridge Capital,"Online Grocery, WestBridge Capital",1.396,387.0,600.0,227.0,"Series E, Jan 27, 2022, $210M",Series E,2022,210.0,"DealShare is an Indian unicorn startup. It operates in the social_commerce sector. It is based in Bangalore. Current stage: Series E. Online social deal-sharing platform for multi-category products. The company offers deals on various products like fruits & vegetables, grocery items, fashion accessories, home decor products, and more. It allows users to buy and share deals with their friends. The company offers discounts depending on the number of people purchasing its products. DealShare joined the Unicorn Club on Jan 27, 2022 after raising a $210M Series E funding round led by , , valuing it at $1.71B. Founded in 2018. Time taken to reach unicorn status: 4 years. Joined the unicorn club on 2022-01-27. Became a unicorn in 2022. Investors include Online Grocery, WestBridge Capital, latest round led by Tiger Global Management. Valuation: 1.396 billion USD. Total funding raised: 387.0 million USD. Annual revenue: 600.0 crore INR. It employs approximately 227 people. Latest funding round: Series E. The round took place in 2022. Round amount: 210.0 million USD."
88,Darwinbox,https://tracxn.com/d/companies/darwinbox/__ZCneLgVtiUmrHNSY4KraMosyXpf9MPS6bB1_9kIpQmk,India,"Cloud-based suite solutions for HR management. The product modules include AI augmented workforce analytics, OCR and HR automation, payroll and talent management, employee engagement, onboarding, recruitment, expense management, rewards, and recognition, shift rostering, workflow and knowledge management and more. It also enables users to manage their time, attendance, leave, vacations, insights, payslips and more. It also offers employee data management and training resources such as documentation, live online sessions, videos, webinars, and in-person training.","Darwinbox joined the Unicorn Club on Jan 25, 2022",2022-01-25,2022,hrtech,hyderabad,Series D,2015,7 years,84,,TCV,KKR,"TCV, KKR",0.924,280.0,393.0,1049.0,"Series D, Mar 05, 2025, $140M",Series D,2025,140.0,"Darwinbox is an Indian unicorn startup. It operates in the hrtech sector. It is based in Hyderabad. Current stage: Series D. Cloud-based suite solutions for HR management. The product modules include AI augmented workforce analytics, OCR and HR automation, payroll and talent management, employee engagement, onboarding, recruitment, expense management, rewards, and recognition, shift rostering, workflow and knowledge management and more. It also enables users to manage their time, attendance, leave, vacations, insights, payslips and more. It also offers employee data management and training resources such as documentation, live online sessions, videos, webinars, and in-person training. Darwinbox joined the Unicorn Club on Jan 25, 2022 Founded in 2015. Time taken to reach unicorn status: 7 years. Joined the unicorn club on 2022-01-25. Became a unicorn in 2022. Investors include TCV, KKR. Valuation: 0.924 billion USD. Total funding raised: 280.0 million USD. Annual revenue: 393.0 crore INR. It employs approximately 1049 people. Latest funding round: Series D. The round took place in 2025. Round amount: 140.0 million USD."
87,LEAD School,https://tracxn.com/d/companies/lead-school/__oe2fP0y2p5mZsRCJMPA-zjkY8OB81N8chnQAbwrkRSM,India,"Provider of a digital learning solutions for schools and teachers. The company provides a comprehensive digital learning platform designed to enhance the educational experience for students, teachers, and administrators. This includes curriculum resources, teacher training programs, and technological tools to support both in-school and at-home learning. The platform offers features such as student and class management systems, digital classrooms, and assessment tools. The company also supports teacher professional development through online academies and in-person workshops. The goal is to empower educators and improve student outcomes through technology-integrated learning.","LEAD School joined the Unicorn Club on Jan 12, 2022 after raising a $101M Series E funding round led by , , valuing it at $1.13B.",2022-01-12,2022,k-12_edtech,mumbai,Series E,2012,10 years,120,WestBridge Capital,WestBridge Capital,Standard Chartered,"WestBridge Capital, Standard Chartered",0.997,172.0,370.0,1121.0,"Series E, Jan 04, 2024, $1.14M",Series E,2024,1.1,"LEAD School is an Indian unicorn startup. It operates in the k-12_edtech sector. It is based in Mumbai. Current stage: Series E. Provider of a digital learning solutions for schools and teachers. The company provides a comprehensive digital learning platform designed to enhance the educational experience for students, teachers, and administrators. This includes curriculum resources, teacher training programs, and technological tools to support both in-school and at-home learning. The platform offers features such as student and class management systems, digital classrooms, and assessment tools. The company also supports teacher professional development through online academies and in-person workshops. The goal is to empower educators and improve student outcomes through technology-integrated learning. LEAD School joined the Unicorn Club on Jan 12, 2022 after raising a $101M Series E funding round led by , , valuing it at $1.13B. Founded in 2012. Time taken to reach unicorn status: 10 years. Joined the unicorn club on 2022-01-12. Became a unicorn in 2022. Investors include WestBridge Capital, Standard Chartered, latest round led by WestBridge Capital. Valuation: 0.997 billion USD. Total funding raised: 172.0 million USD. Annual revenue: 370.0 crore INR. It employs approximately 1121 people. Latest funding round: Series E. The round took place in 2024. Round amount: 1.1 million USD."
86,Fractal Analytics,https://tracxn.com/d/companies/fractal-analytics/__F79MJo3SBJC1a817Xo1C4y6LFAxk7nRoG1bL5Qk5Pt0,United States,"AI powered decision support and data analytics software for enterprises. It enables users to ask questions, and the AI generates answers based on user queries. The platform generates insights and summaries from the datasets. The platform allows users to analyze business data and generate insights for business decision making. Its offering includes forecasting, consumer insights, customer life cycle management, data engineering, MLops, image, and video analytics, and more. It caters its solution to industries such as finance, retail, healthcare, insurance, and more.","Fractal Analytics joined the Unicorn Club on Jan 05, 2022 after raising a $360M Series E funding round led by , valuing it at $1B.",2022-01-05,2022,business_intelligence,new york city,Series E,2000,22 years,264,TPG,Natural Language Processing,Generative AI,"Natural Language Processing, Generative AI",1.0,685.0,2040.0,4070.0,"Series E, Jan 05, 2022, $360M",Series E,2022,360.0,"Fractal Analytics is an Indian unicorn startup. It operates in the business_intelligence sector. It is based in New York City. Current stage: Series E. AI powered decision support and data analytics software for enterprises. It enables users to ask questions, and the AI generates answers based on user queries. The platform generates insights and summaries from the datasets. The platform allows users to analyze business data and generate insights for business decision making. Its offering includes forecasting, consumer insights, customer life cycle management, data engineering, MLops, image, and video analytics, and more. It caters its solution to industries such as finance, retail, healthcare, insurance, and more. Fractal Analytics joined the Unicorn Club on Jan 05, 2022 after raising a $360M Series E funding round led by , valuing it at $1B. Founded in 2000. Time taken to reach unicorn status: 22 years. Joined the unicorn club on 2022-01-05. Became a unicorn in 2022. Investors include Natural Language Processing, Generative AI, latest round led by TPG. Valuation: 1.0 billion USD. Total funding raised: 685.0 million USD. Annual revenue: 2040.0 crore INR. It employs approximately 4070 people. Latest funding round: Series E. The round took place in 2022. Round amount: 360.0 million USD."
85,Mamaearth,https://tracxn.com/d/companies/mamaearth/__e9IhGi4vcWYMieVXmjjqGyG7HyDm3uSbrTRkGggsf9M,India,"Online brand offering multi-category natural skin care and makeup products. It includes shampoos, conditioners, body lotions, face wash, body wash, moisturizers, lip balms, and more. It also offers baby care products and color cosmetics like lipsticks, lip balms, foundation, concealers, and more.","Mamaearth joined the Unicorn Club on Dec 29, 2021",2021-12-29,2021,beauty_&_personal_care_products,gurgaon,Public,2016,5 years 11 months,71,,Beauty Tech,Sofina,"Beauty Tech, Sofina",0.089,,1970.0,958.0,"Angel, Sep 13, 2022, $755K",Angel,2022,,"Mamaearth is an Indian unicorn startup. It operates in the beauty_&_personal_care_products sector. It is based in Gurgaon. Current stage: Public. Online brand offering multi-category natural skin care and makeup products. It includes shampoos, conditioners, body lotions, face wash, body wash, moisturizers, lip balms, and more. It also offers baby care products and color cosmetics like lipsticks, lip balms, foundation, concealers, and more. Mamaearth joined the Unicorn Club on Dec 29, 2021 Founded in 2016. Time taken to reach unicorn status: 5 years 11 months. Joined the unicorn club on 2021-12-29. Became a unicorn in 2021. Investors include Beauty Tech, Sofina. Valuation: 0.089 billion USD. Annual revenue: 1970.0 crore INR. It employs approximately 958 people. Latest funding round: Angel. The round took place in 2022."
84,GlobalBees,https://tracxn.com/d/companies/globalbees/__9KuW22FoOfUKIf6ZljAxgmF6bfOhza2YcdyWmFsv_iM,India,Platform acquiring e-commerce brands. The company acquires and helps in brand growth across different consumer segments. The company evaluates the businesses and prepares their due diligence. They also have an online store offering fashion accessories and apparel.,"GlobalBees joined the Unicorn Club on Dec 19, 2021",2021-12-19,2021,brands_tech,delhi,Series B,2021,11 months,11,,E-Commerce Enablers,ChrysCapital,"E-Commerce Enablers, ChrysCapital",0.923,186.0,20.8,230.0,"Conventional Debt, Feb 06, 2024, $18.1M",Conventional Debt,2024,18.1,"GlobalBees is an Indian unicorn startup. It operates in the brands_tech sector. It is based in Delhi. Current stage: Series B. Platform acquiring e-commerce brands. The company acquires and helps in brand growth across different consumer segments. The company evaluates the businesses and prepares their due diligence. They also have an online store offering fashion accessories and apparel. GlobalBees joined the Unicorn Club on Dec 19, 2021 Founded in 2021. Time taken to reach unicorn status: 11 months. Joined the unicorn club on 2021-12-19. Became a unicorn in 2021. Investors include E-Commerce Enablers, ChrysCapital. Valuation: 0.923 billion USD. Total funding raised: 186.0 million USD. Annual revenue: 20.8 crore INR. It employs approximately 230 people. Latest funding round: Conventional Debt. The round took place in 2024. Round amount: 18.1 million USD."
83,Pristyn Care,https://tracxn.com/d/companies/pristyn-care/__QEWxHLBugEsT_XwDFV-JrRNqtedJdqnyI8ro2b-OQf0,India,Online platform to book appointments for in-person and virtual consultations. The platform enables users to book an appointment with a team of healthcare experts for in-person or remote consultation for various medical conditions. Users can also book slots for vaccination doses and can track appointments and other surgery-related details by using an app.,"Pristyn Care joined the Unicorn Club on Dec 07, 2021 after raising a $100M Series E funding round led by , ,  and  more, valuing it at $1.37B.",2021-12-07,2021,healthcare_booking_platforms,gurgaon,Series E,2018,3 years 11 months,47,Tiger Global Management,Sequoia Capital,Tiger Global Management,"Sequoia Capital, Tiger Global Management",1.154,181.0,632.0,962.0,"Series E, Dec 07, 2021, $100M",Series E,2021,100.0,"Pristyn Care is an Indian unicorn startup. It operates in the healthcare_booking_platforms sector. It is based in Gurgaon. Current stage: Series E. Online platform to book appointments for in-person and virtual consultations. The platform enables users to book an appointment with a team of healthcare experts for in-person or remote consultation for various medical conditions. Users can also book slots for vaccination doses and can track appointments and other surgery-related details by using an app. Pristyn Care joined the Unicorn Club on Dec 07, 2021 after raising a $100M Series E funding round led by , ,  and  more, valuing it at $1.37B. Founded in 2018. Time taken to reach unicorn status: 3 years 11 months. Joined the unicorn club on 2021-12-07. Became a unicorn in 2021. Investors include Sequoia Capital, Tiger Global Management, latest round led by Tiger Global Management. Valuation: 1.154 billion USD. Total funding raised: 181.0 million USD. Annual revenue: 632.0 crore INR. It employs approximately 962 people. Latest funding round: Series E. The round took place in 2021. Round amount: 100.0 million USD."
